[tutorial] syncing your calendar and the  by,b
[tutorial] syncing your calendar and the  by,b
top informativo   dont use the mobile without knowing these tips  recently re vamped t,b
be you get the right result from inmail?vium,b
be you get the right result from inmail?vium,b
[tutorial] syncing your calendar and the  by,b
break down the anatomy of a successful profile [infographic] via,b
announce acquisition,b
can t wait to download the  for my nokia 3310!,b
please email us at with a detailed description of what hen,b
when it come to exp across channel mobile doesn t feel the same as the web browser hope ur team be work on it,b
. please fix your utterly unusable and gutless ipad . i would love to have full functionality through the on ipad.,b
we ve been thinking about turnover in the wrong way via  ;,b
seek ain,b
problem solved. have ro reinstall again,b
i deactivate my facebook account,b
how to use to connect with prospectsvium,b
how to use to connect with prospectsvium smexaminer,b
how to use to connect with prospectsvium smexaminer,b
how to use to connect with prospect on via.,b
i m cut more slack for un personalized request prominent connect button on doesn t give oppty to update.,b
the  is pretty awful for me too. had been really buggy lately,b
you can clear cache for specific pages   if doesn t help,b
used to automate activity on and via,b
just went onto the  to endorse you for something dumb,b
hi in my  so android it doesn t update the news feed,b
the steamiest pretty little liar throwback that fan just can t get over,b
my boss is an !  by on,b
my boss be an !,b
hi morgan  that shouldn t be hening,b
hey geoff! that shouldn t be hening  if it persists,b
i think it s pretty lame that i can t recruit from my seat through my . like,b
10 reason why a dept should report to ; not to sale via,b
the 504 hen on the redirect back from verification. buffer do not resolve the connection to .,b
10 random thing you didnt know you can do on,b
have you try uninstallingreinstal the ; rebooting? if that doesn t work pls email us at,b
practical calculator for roll dimension and pallet optimisation von auf,b
except for urgent change,b
except for urgent change,b
didnt go to college,b
somehow my  requested to connect with everyone in my phone. i ve been syncing contacts to icloud for 7 years,b
do you upload the same textpic to why not upload them through my certeralized,b
how to use the relationship tab to improve your networking,b
how to use to connect with prospectsvium,b
twittosofia how to use to connect with prospectsvium smexaminer,b
cant open weblink on desktop,b
do you upload the same textpic to why not upload them through my certeralized,b
be a good damn,b
to act as an intelligent assistant in,b
can you make your stop ask me every time to sync my calendar no mean no.,b
take over and now their constantly crash ; win t open. priceless.,b
. my iphone just automatically update your and it crash before it even open now,b
didn t have the highest bid for,b
connect thelowdown,b
upload to from the same certeralize,b
anyone have try to use for showcase pages? it doesn t work for me.,b
my recommendation for olx,b
not only motivate,b
luz seek ain or,b
luz seek ain or,b
why io doesn t support pages?,b
hi ewa. that shouldn t be the case. if you have a specific example,b
email with connect invite,b
we wish as well but win t allow via their api. you can upload your resume via the or email us with it,b
grey singapore win a cannes lion by exploit the refugee criris ; by present an that wasn t functional.,b
grey singapore win a cannes lion by exploit the refugee criris ; by present an that wasn t functional.,b
lessons learned from building a  in six months,b
drivify new age .png,b
date request to connect on,b
err_connection_refuse everytime i open .chnged my primary mail id.try both your say invalid erytme.,b
worse award go to,b
lessons learned from building a  in six months,b
and let be clear digital transformation wont hen with another bolt on cloud or a giant implementation,b
boss  they tied up with and created a substitute that imports contacts into . i didn t want that.,b
for a few weeks now i haven t been able to get into my  on my iphone anyone know why!?,b
lessons learned from building a  in six months,b
the that doesn t exist yet but many of us nasm trainer would love see the group,b
hey guy ever fix that issue with try to upload resume to potential employers?? kinda like..,b
lessons learned from building a  in six months,b
i hate how the  says i have notifications,b
it ain t your grandma s framework  by on,b
yikes! if that hen again,b
it ain t your grandma s framework  by on,b
if this podbumisn t,b
if this podbumisn t,b
realifex is proud to announce a new  realifechange,b
it ain t your grandma s framework,b
brazen connect,b
three quick reason why you should be on,b
outstanding advice for make the most of in your career,b
if we match on a date and still haven t meet,b
outstanding advice for make the most of in your career,b
fix your,b
fix your,b
how to use to connect with prospect,b
let you know all about that activity who be,b
10 reason why a dept should report to ; not to sale via,b
the  is absolute pants  so called improvements just make it worse! will come off unless things improve.,b
shouldn t be any issue,b
permission not granted? use denied!,b
for issue regard your account,b
outdo everything else,b
vaccination alert helping healthcare organizations improve patient care significantly!  on,b
outdo everything else,b
dare i open the update ? scare it will try to get me to connect with every fucker else on that fucking network.,b
my damn  just invited all my bloody contacts. i pressed skip. infuriating.,b
permission not granted? use denied!,b
hey i d love it if you d quit with the push notification until your doesn t constantly crash or refuse to load. kthnx!,b
get sad i haven t open the in a while so they notify me that someone look at my profile but they can t tell me who. fail.,b
hello! i don t think so,b
how used lmdb to fix their io crash and performance issue,b
how used lmdb to fix their io crash and performance issue,b
have every possible notification setting turn off for,b
how can i distribute an widget for a hotel website?  on,b
how used lmdb to fix their io crash and performance issue,b
so bored i just log into my account.,b
best of luck!  jobs is great if you haven t checked it out,b
website,b
related buggy  freezes on the notification screen,b
acquire sale presentation makerpointdrive,b
acquire sale presentation makerpointdrive via,b
acquire sale presentation makerpointdrive,b
acquire sale presentation makerpointdrive,b
acquire sale presentation makerpointdrive via,b
the isn t open on iphone 6s,b
acquire sale presentation makerpointdrive,b
acquire sale presentation makerpointdrive,b
use your account with floyd and to find your next opportunity!,b
acquire sale presentation makerpointdrive,b
acquire sale presentation makerpointdrive via,b
acquire sale presentation makervia,b
break the link! try this one,b
be anyone else have trouble be mobile ? it be down more that it be up and i wonder if i alone be experience this problem?,b
starbucks be the industry leader for many more reason than just its great,b
the secret to increase your roi isnt more its targeting.,b
the only you can have say that would have be worse be,b
acquire pointdrive for sale oriented presentation,b
acquire pointdrive for sale oriented presentation,b
acquire pointdrive for sale oriented presentation,b
acquire pointdrive for sale oriented presentation,b
acquire pointdrive for sale oriented presentation our vision of differentiate buyer engagement,b
acquire for sale oriented presentation,b
acquire for sale oriented presentation,b
how do you turn off stupid notification from stupid ? i don t want to know every time someone i know so much as sneezes.,b
acquire pointdrive for sale oriented presentation,b
i hate get requests. i ve never see the point of that site.,b
screen synthetic adulterant from herbal and dietary supplement,b
socialmedia_coe | don t use the mobile without know these t,b
google finally fix the most frustrating problem with its map,b
in mail must be used effectively,b
in mail must be used effectively,b
we have a great for your event! to auto collect attendees  via bluetooth. can we demo you?,b
its quite remarkable that really make its worse with every release.,b
its quite remarkable that really make its worse with every release.,b
we be hiring! sec consultant,b
the  won t let me login for weeks false credentials though the same ones work on . known issue?thanks,b
etiquette be you break the rules?via,b
etiquette be you break the rules?via,b
french bilingual sr.coordinator,b
my  won t open on my ipad air.,b
upload to from the same certeralize,b
have there ever be an more buggy than ?,b
when a job ask you to connect your ; upload your resume,b
my hootsuite in my mobile show my personal profile but doesn t show my 3 pages. be there a solution?,b
you don t hen to know if a uwp  is on its way?,b
sick of the notification that tells me  you don t have any notifications yet!,b
hi ;  why i can t see my newlast connections in the notifications part on the ;,b
have to remove your because the notification wouldn t stop,b
hope the mobile team at track and fix all the crash,b
is looking for bilingual french  consumer specialist,b
why do you bother me with connect to useless ppl,b
most egregious case ive find be take you to the when purposefully browse while signed out.,b
any chance you can respond to issue of ipad crash on launch? replace the have not worked.,b
i ve get my twitter ; on there. insta still doesn t work too well with scheduling. facebook in schedule good,b
. why be your so big when it doesn t have or need many features?,b
goal the self confidence of middle age man on who use the work to hit on women.,b
may i suggest that facebook,b
sky ridge medical center,b
