technical support specialist,f
maintenance and support of a property and casualty insurance  by on,f
the fighting sexual assault by recognizing screams and auto phoning the police  written by stephen altrogge,f
meet wish,f
i agree 120%!,f
when can we expect uwp of for window 10??,f
used tool a buzzword for enterprise,f
person list feature on be already there for web,f
make sure you have the ice standard emergency on your lock screen and not a health .,f
develop iosandroid for any specific industry for 950,f
field technician  calgary,f
field technician  edmonton,f
man i get so many unsolicited email fromviakinda,f
pin on;,f
pin on;,f
when you open your; your big brother is in your feed  expanding the frontiers of science!,f
travel web design regarding net development  on,f
you may think neon be ugly,f
the best stack to create your web   by on,f
used tool a buzzword for,f
there be no really any new feature that would make one to use it routinely,f
any plan to build better window 10 now?,f
how to pin on;,f
yuqi on the identity team and her contribution will soon be a feature of the .,f
why was the dohow developed?  by on,f
for songwriter you can also submit yourfor more viewer ; users!!,f
a hybrid of tinder  for electing our representatives in localnational parliament.,f
the search ui only show up in the io for me,f
weekly digest  dashboard,f
jaspalsgnr  i will create any native android using beautiful ui for $5 on,f
honour to have my concept design taptable showcase,f
interactionuser interface by,f
interactionuser interface by,f
yuqi on the identity team and her contribution will soon be a feature of the .,f
what language should i use for my saas ?,f
nanu win the best in the communication category from ! this only inspire us to do even better,f
back to the draw board startup cinch pull down its to rework it.,f
back to the draw board startup cinch pull down its to rework it.,f
my request recruiter,f
maintenance and support of a property and casualty insurance   by on,f
new feature from talkwalker time lapse graph,f
you own now. make better fordont you agree?,f
you should still be able to send them out,f
the  is installed on more devices than candy crush,f
a vey good with good point to consider in any,f
need an in windchill to export a bom?   on,f
new sage x3 for window 10!,f
students should integrate itself within the  for higher efficiency.,f
be there plan for a window 10 ?,f
co work est un mode de vie,f
comprehensive mobility solution from cross platform to native development we have it all! we even have mdm,f
the art of minimalism in mobile ui design ux planet,f
used tool a buzzword for,f
build a web with core,f
introduce bumblebizz tinder meet via,f
introduce bumblebizz tinder meet via,f
introduce bumblebizz tinder meet,f
agree,f
why is  feed  different on    and  web ??,f
fall in love with notes  notesgen the notes sharing,f
introduce bumblebizz tinder meet,f
introducing bumblebizz tinder meets  via adamhoulah,f
introduce bumblebizz tinder meet,f
new released smart home management fingerprint door lock mf 51  on,f
buys pointdrive for its integrated email presentation  via,f
we have upgrade the office from shoreditch to mayfair,f
using open data to plan a theft  however police can also use same to crack the theft. in smart city,f
hybrid used tool a buzzword for,f
add native video with autoplay on desktop,f
do you have the next best idea? be you make the smart choice with development?,f
web or usability a tale of two transportation tools  by on,f
tips for best ios design to improve earance of your   by on,f
insight on architecture for microsoft option ; alternatives. buyer choice,f
niftytool  announced today that it isopen sourcing a tool,f
open sources nifty &lt;b;android&lt;b; testing tool  announced,f
dear  your ui sucks. my ux no good. improve the messy web of yours if you wish to have more friends. thanks.,f
how to plan with a small budget,f
. have introduce acal record that let film themselves answer questions.,f
