,tweet,Date
0,check out kendall and kylie!,2016-06-17
1,i m in the 100k club in kendall and kylie  come join me!,2016-06-18
2,i m in the 100k club in kendall and kylie  come join me!,2016-06-18
3,i m in the 1k club in kendall and kylie  come join me!,2016-06-18
4,we re off to montreal with  ,2016-06-18
5,help me share this! i m selling kendall   kylie cut out bustier for 60 00usd in garden grove on the free 5mile  ,2016-06-18
6,i m in the 1 million club in kendall and kylie  come join me!,2016-06-18
7,check out kendall and kylie!please retweet,2016-06-18
8,and download the kendall and kylie,2016-06-18
9,i m in the 100 club in kendall and kylie  come join me!,2016-06-18
10,check out kendall and kylie!looool,2016-06-18
11,check out kendall and kylie!yo,2016-06-18
12,i m in the 10k club in kendall and kylie  come join me!,2016-06-18
13,check out kendall and kylie!help me get 1000 follower x,2016-06-18
14,this kylie and kendall be actually decent,2016-06-18
15, tcehy  gluuv 1 4 0  4 55  iphone world grossing rankings as of jun 17,2016-06-18
16,check out kendall and kylie!hi i what you all to go uppppppppp! laugh out loudllll,2016-06-18
17,still awake bc i start a timed event on the kendall and kylie and i be very commit to get 5 star so,2016-06-18
18,check out kendall and kylie!,2016-06-18
19,check out kendall and kylie!,2016-06-18
20,this be so cute!! check out kendall and kylie!,2016-06-18
21,check out kendall and kylie! ,2016-06-19
22,start the kendall and kylie !!,2016-06-19
23,i create you in kendall and kylie,2016-06-19
24,check out kendall and kylie!laugh out loud,2016-06-19
25, tcehy  gluuv 1 4 0  4 55  iphone world grossing rankings as of jun 18,2016-06-19
26,hooked on stripe knot front t shirt dress that i find on the pacsun,2016-06-19
27, tcehy  gluuv 1 4 0  4 55  iphone world grossing rankings as of jun 19,2016-06-20
28,what do i do this break? i get addict to kendall   kylie s,2016-06-20
29,my brother   uncle play the kendall   kylie be the funniest thing ever,2016-06-20
30,download kendall   kylie s now if you still haven t! you don t know what you re miss,2016-06-20
31,my kendall and kylie isn t working,2016-06-20
32,i must truly love i even delete the kendall and kylie for this ,2016-06-20
33,all my pacsun paradise lose photos!,2016-06-20
34,kendall   kyliethis be absolutely amazingeveryone may like itcheck it out,2016-06-21
35,hooked on deep v neck bodysuit that i find on the pacsun,2016-06-21
36,loving the kendall   kylie  ,2016-06-21
37,kendall and kylie be better,2016-06-21
38,beating my high score on  like challenge   got me feeling like kylie and kendall,2016-06-21
39,kendall and kylie,2016-06-21
40,kendall and kylie,2016-06-21
41, tcehy  gluuv 1 4 0  4 55  iphone world grossing rankings as of jun 20,2016-06-21
42,i m in the 1k club in kendall and kylie  come join me!,2016-06-21
43,think i get a crush on emily sun from the kendall   kylie game,2016-06-21
44,check out kendall and kylie!,2016-06-21
45,i m addict to kendall kylie !!! loving it so farrr,2016-06-21
46,i m addict to kendall kylie !!! loving it so farrr,2016-06-21
47,do your ass know i even get over 70m follower on the kendall and kylie,2016-06-22
48, tcehy  gluuv 1 4 0  4 55  iphone world grossing rankings as of jun 21,2016-06-22
49,beating level 20 in the  respeck on my name  got me like kendall and kylie jenner,2016-06-22
50,the kendall and kylie be decentload of drama hen,2016-06-22
51,i may or may not have download the kendall and kylie hi,2016-06-22
52,im in the 1k club in kendall and kylie  come join me!,2016-06-23
53,i m in the 1 million club in kendall and kylie  come join me!,2016-06-23
54,do xx sorry late,2016-06-23
55, tcehy  gluuv 1 4 0  4 55  iphone world grossing rankings as of jun 22,2016-06-23
56,im loving  kendall and kylie  oh my god,2016-06-23
57,check out kendall and kylie!,2016-06-23
58,i m in the 10k club in kendall and kylie  come join me! im famoose binch,2016-06-23
59,download the kendall and kylie to fill the void in my vapid materialistic existence,2016-06-23
60,i be just play the kendall and kylie and this pop up im freaking out its,2016-06-23
61,you re on the kendall and kylie i m freaking out!!,2016-06-23
62,i be just play the kendall and kylie and this pop up im freaking out its,2016-06-23
63,you re on the kendall and kylie i m freaking out!!,2016-06-23
64,alright but can i tell about how my boyfriend on the kendall and kylie break up with me  i can t even have a relationship on that game ,2016-06-24
65,just get so mad at kendall and kylie and delete the,2016-06-24
66,okay this be go to be an ugly tweet but i waste my gem on the kendall and kylie on energy and then i get 2 energy 5 second later,2016-06-24
67, tcehy  gluuv 1 4 0  4 55  iphone world grossing rankings as of jun 23,2016-06-24
68,so i download the kendall and kylie uhmm   i don t know why,2016-06-24
69,i liked a video fromkendall   kylie game   part 3  new pet,2016-06-24
70,look so good in the kendall and kylie,2016-06-24
71,look so good in the kendall and kylie,2016-06-24
72,check out kendall and kylie! lt 3,2016-06-25
73,oh okay uhm neko atsume !!,2016-06-25
74, tcehy  gluuv 1 4 0  4 55  iphone world grossing rankings as of jun 24,2016-06-25
75,go to the store and by kendall and kylie game,2016-06-25
76,downloaded the kendall and kylie  hays anez na? kumusta naman ang life,2016-06-25
77,kendall kylie be so fun!!,2016-06-25
78,i m in the 100 club in kendall and kylie  come join me!,2016-06-25
79,what the fuck i earn 200  gem   reach 100k for kendall kylie game aft month   my phone get stuck   it get back to 70k   6 gems piece of shit,2016-06-25
80,my amaze new look thank to kendall and kylie!,2016-06-25
81,getting past level 40 on  like challenge  got kendall and kylie like,2016-06-26
82,check out kendall and kylie! ,2016-06-26
83,kendall and kylie by glu game inc go download kendall and kylie s it s great,2016-06-26
84,i m in the 100 club in kendall and kylie  come join me! i restart it again,2016-06-26
85,holy shit the kendall and kylie be large i have to delete three s  but that ok,2016-06-26
86,i m soooooo obsessed with the kendall and kylie,2016-06-26
87, tcehy  gluuv 1 4 0  4 55  iphone world grossing rankings as of jun 25,2016-06-26
88,kendall and kylie s s just drop and your life will never be the same,2016-06-26
89,kendall and kylie s game be amazing,2016-06-26
90,obsesed with the kylie and kendall game now,2016-06-26
91,laugh out loud playing kendall and kylie    and yes i like it,2016-06-26
92,check out kendall and kylie!so cool,2016-06-26
93,that kendall and kylie fashion show be amazing!,2016-06-26
94,my kendall and kylie doesn t work,2016-06-27
95,i m loving this new,2016-06-27
96,you know you re really fucking bore when you download the kendall   kylie,2016-06-27
97,we re off to montreal with  ,2016-06-27
98,ignore everyone bc play the kendall and kylie,2016-06-27
99, tcehy  gluuv 1 4 0  4 55  iphone world grossing rankings as of jun 26,2016-06-27
100,be i the only one who play kendall and kylie here?,2016-06-27
101,when you find on the kylie and kendall game,2016-06-27
102,when you find on the kylie and kendall game,2016-06-27
103,ariana have some love so much your so much love you so much king so much thank you i m level 8 on kylie and kendall,2016-06-27
104,kendall   kylie is always wanting me to  come back   play,2016-06-27
105,kendall   kylie is always wanting me to  come back   play,2016-06-27
106,i want to succumb to my instinct and get that kendall and kylie   i m so disoint in me,2016-06-28
107,hooked on reversible stry bralette bikini top that i find on the pacsun,2016-06-28
108,i m addict to the kendall and kylie game,2016-06-28
109,play respeck on my name get me like kendall and kylie jenner,2016-06-28
110, tcehy  gluuv 1 4 0  4 55  iphone world grossing rankings as of jun 27,2016-06-28
111,i m play kendall   kylie s,2016-06-28
112,how to play kendall   kylie game,2016-06-28
113,throwback of khlo and kylie from kylie s,2016-06-28
114,wake up early just to play kendall   kylie,2016-06-28
115,the kendall and kylie resta my whole fucking game  what the fuck im so mad,2016-06-29
116,i m in the 100 club in kendall and kylie  come join me!,2016-06-29
117,oh my god??! this be insane you re in an with kylie and kendall i m die,2016-06-29
118, tcehy  gluuv 1 4 0  4 55  iphone world grossing rankings as of jun 28,2016-06-29
119,the best kendall and kylie,2016-06-29
120,play the kylie and kendall   i find it a bit bore,2016-06-29
121,be just casually play the kylie and kendall when all of a sudden  ,2016-06-29
122,i m in the 100 club in kendall and kylie  come join me! please,2016-06-29
123,now free!,2016-06-29
124,spinrilla,2016-06-30
125,why cant i date perry young on kendall   kylie s new ? he s so nice  ,2016-06-30
126,youre wasting your time  delete that,2016-06-30
127, tcehy  gluuv 1 4 0  4 55  iphone world grossing rankings as of jun 29,2016-06-30
128,life would be much easier if it be like the kendall and kylie,2016-06-30
129,unseen photo of kylie,2016-06-30
130,unseen photo of kylie,2016-06-30
131,things i want ariana to release  guys clothes candles an  like kendall   kylie  remix album of dw concert tour dvdblu ray,2016-06-30
132,i just subscribe to kendall and kylie jenner s and i think i deserve a michael kor bag just for do that,2016-06-30
133,things i want ariana to release  guys clothes candles an  like kendall   kylie  remix album of dw concert tou,2016-06-30
134,how do i sign into kendall and kylie with twitter ???,2016-06-30
135,hopefully at some point you can trade in your boyfriend in the kendall and kylie for a real boyfriend  if not i have waste lot of time,2016-07-01
136,check out kendall and kylie!,2016-07-01
137,check out kendall and kylie!,2016-07-01
138,store games  the kendall and kylie game is coming soon ,2016-07-01
139,new old picture of kendall and kylie on kendall s   kylie s,2016-07-01
140, tcehy  gluuv 1 4 0  4 55  iphone world grossing rankings as of jun 30,2016-07-01
141,    updatejenner kylie post a special message to her fan regard kylie cosmetic on her   check it out!,2016-07-01
142,    updatejenner  kyliejenner giveaway alert! i signed a polaroid from my puma shoot on my,2016-07-01
143,download the kendall   kylie game at the store,2016-07-02
144,you must be the one who hack the kendall and kylie thing lmao,2016-07-02
145, tcehy  gluuv 1 4 0  4 55  iphone world grossing rankings as of jul 1,2016-07-02
146,can taylor swift please release her game now huhu the kendall kylie game have so many bug im so tired of the stress,2016-07-02
147,android kendall   kylie 50  discount!,2016-07-02
148,kendall   kylie 50  discount!,2016-07-02
149,kendall and kylie be do eyyyyy,2016-07-02
150,check out kendall and kylie!i hate layla sooo much,2016-07-02
151,this really look like the kendall and kylie,2016-07-02
152,spend 4 on a dress on the kendall   kylie   ive never be more disointed in her  ,2016-07-02
153,i love kendall amd kylie s,2016-07-02
154,check out kendall and kylie!,2016-07-03
155,can someone hack my kendall and kylie,2016-07-03
156,download the kendall and kylie what have i do,2016-07-03
157,kendall and kylie be soooo good,2016-07-03
158, tcehy  gluuv 1 4 0  4 55  iphone world grossing rankings as of jul 2,2016-07-03
159,that panic moment when hapit nako maapsan sa number one spot sa kendall kylie game   laugh out loud ,2016-07-03
160,i m in the 100 club in kendall and kylie  come join me! i love game,2016-07-03
161,do u have the kendall and kylie ?,2016-07-03
162,i m in the 1k club in kendall and kylie  come join me!,2016-07-03
163,i m in the 100 club in kendall and kylie  come join me!  i m doing this for more coins,2016-07-03
164,why are you single?  it probably has something to do with the fact i do things like subscribe to the kylie jenner   and kendall s,2016-07-03
165,latest tech check kendall and kyly make million,2016-07-04
166,i add a video to a playlist what the heck   kendall   kylie new ?,2016-07-04
167, tcehy  gluuv 1 4 0  4 55  iphone world grossing rankings as of jul 3,2016-07-04
168,for some bloody stupid reason,2016-07-04
169, tcehy  gluuv 1 4 0  4 55  iphone world grossing rankings as of jul 4,2016-07-05
170,20 celeb worthy find from,2016-07-05
171,20 celeb worthy find from,2016-07-05
172,brings popsugar content to kendall   kylie lifestyle simulation game  read more   gluu,2016-07-05
173, tcehy  gluuv 2 0 0 ios update released  4 55,2016-07-05
174,just have fun playkng kendall   kylie   ,2016-07-09
175,check out kendall and kylie!javing so much fun!!!,2016-07-09
176, tcehy  gluuv 2 0 0  4 55  iphone world grossing rankings as of jul 8,2016-07-09
177,just have the urge to play kendall and kylie but i have to remind myself that i delete that bc i be addict and it be unhealthy,2016-07-09
178,my new insomnia  kendall   kylie   easy,2016-07-09
179,i m in the 1 million club in kendall and kylie  come join me! yass,2016-07-09
180,so i be now live vicariously on the kendall   kylie hahahah why do i even download this i need help,2016-07-09
181,all i have be do be play the episode,2016-07-09
182,do you know your on kendall and kylie,2016-07-09
183,play kendall and kylie,2016-07-09
184,when you find out joey be on the kendall and kylie for escape the night,2016-07-09
185,outfit on the kendall and kylie,2016-07-09
186,pokemon go and the kendall and kylie take over my life ,2016-07-10
187,just spend another  5 on the kendall   kylie so now i really hate myself,2016-07-10
188,check out kendall and kylie!hy!!!!!,2016-07-10
189,i just make my kendall and kylie character look like you,2016-07-10
190,laugh out loud i miss playing sssmt delete that last sem haaha along with kendall kylie hahahaaahhaha,2016-07-10
191,check out kendall and kylie!v,2016-07-10
192,i just make my kendall and kylie character look like you,2016-07-10
193, tcehy  gluuv 2 0 0  4 55  iphone world grossing rankings as of jul 9,2016-07-10
194,check out kendall and kylie!me,2016-07-10
195,practically like shopping withirl,2016-07-10
196,hooked on kendall   kylie crochet bralette that i find on the pacsun  ,2016-07-10
197,i keep switch between the kim k and the kendall and kylie because i m wait for my energy to get back,2016-07-10
198,i stg the kendall   kylie have ruin me,2016-07-10
199,check out kendall and kylie!,2016-07-11
200,i m in the 1k club in kendall and kylie  come join me! as a guy,2016-07-11
201,i m addict to kendall   kylie s why,2016-07-11
202,i m addict to kendall   kylie s why,2016-07-11
203,i remember have the kendall kylie and i be top,2016-07-11
204,leave kendall kylie game  ,2016-07-11
205, tcehy  gluuv 2 0 0  4 55  iphone world grossing rankings as of jul 10,2016-07-11
206,from amateur sex tape to forbe cover,2016-07-11
207,shop kendall and kylie s summer closet  via,2016-07-11
208,play kendall and kylie have fun,2016-07-11
209,this kendall   kylie jenner be addictive !,2016-07-11
210,i can t even play the kendall   kylie wo fucking something up lmao,2016-07-11
211,see how my lip kit look on different skin tone,2016-07-11
212,i get the hack for the kendall and kylie and i ve livinggg for it,2016-07-12
213,samantha always get me obsessed w the kendall   kylie once i ve finally get over it,2016-07-12
214,samantha always get me obsessed w the kendall   kylie once i ve finally get over it,2016-07-12
215,after convince myself to delete the kendall and kylie,2016-07-12
216,after convince myself to delete the kendall and kylie,2016-07-12
217,kendall and kylie hack cheat free for android apk and io,2016-07-12
218,from amateur sex tape to forbe cover,2016-07-12
219, tcehy  gluuv 2 0 0  4 55  iphone world grossing rankings as of jul 11,2016-07-12
220,i just download the kylie,2016-07-12
221,if you re look for a krew in the kendall and kylie just search for black star you re very welcome to join me,2016-07-12
222,if you re look for a krew in the kendall and kylie just search for black star you re very welcome to join me,2016-07-12
223,i m in the 1000 club in kendall and kylie  come join me!,2016-07-12
224,listen to kylie radio but go through kendall s,2016-07-12
225,who need pokemongo when you can spend your time on a kendall andor kylie jenner ?!,2016-07-12
226,kendall and kylie jenner s debut handbag collection be here,2016-07-13
227,you ll never be as addict to pokemon go as we be to the kendall kylie,2016-07-13
228,life update delete the kylie and kendall,2016-07-13
229,you can actually shop   wardrobe with this  ,2016-07-13
230,you can actually shop   wardrobe with this  ,2016-07-13
231,i m in the 100 club in kendall and kylie  come join me!,2016-07-13
232,life hasnt be the same for me ever since i delete my kendall   kylie,2016-07-13
233,kendall   kylie downloading atm hihi,2016-07-13
234, tcehy  gluuv 2 0 0  4 55  iphone world grossing rankings as of jul 12,2016-07-13
235,do anyone know how to download kendall and kylie if the be not available in your country? i can t download it!,2016-07-13
236,kendall   kylie bag be here!!! go kendall and kylie so proud i love the dog key chain my fave,2016-07-13
237,kendall   kylie bag be here!!!,2016-07-13
238,kendall   kylie bag be here!!!,2016-07-13
239,i get the hack for the kendall and kylie and i ve livinggg for it,2016-07-13
240,kendall and kylie by glu game inc be lit,2016-07-13
241,i m play kendall and kylie game in real life,2016-07-13
242,play kendall and kylie game make me a fashion mogul,2016-07-14
243,i like a video how to unsubscribe from the khloe kendall kim kylie kardashian !,2016-07-14
244,i m play the kendall and kylie fame i can t believe i never delete the,2016-07-14
245,oh my god kendall and kylie get me new friend hahaha,2016-07-14
246,kendall and kylie install,2016-07-14
247,get obsess on kendall and kylie,2016-07-14
248, tcehy  gluuv 2 0 0  4 55  iphone world grossing rankings as of jul 13,2016-07-14
249,check out kendall and kylie! loving this game!,2016-07-14
250,kendall and kylie,2016-07-14
251,kendall kylie tweet,2016-07-15
252,i m in the 100 club in kendall and kylie  come join me! yall,2016-07-15
253,inlove with the  kylie kendall,2016-07-15
254,i m in the 100k club in kendall and kylie  come join me!,2016-07-15
255,be look for a krew in the kendall and kylie  ,2016-07-15
256, tcehy  gluuv 2 0 0  4 55  iphone world grossing rankings as of jul 14,2016-07-15
257,check out kendall and kylie by glu game inc,2016-07-15
258,i m in the 1 million club in kendall and kylie  come join me!,2016-07-15
259,some big surprise come soon for my loyal subscriber detail on my !,2016-07-15
260,i m kinda mad   the kendall and kylie want me to pay to be friend with that s really stupid  ,2016-07-16
261,my kendall and kylie keep freeze as soon as i open it,2016-07-16
262,okay i just hit 1m follower on the kendall   kylie someone pls hold me,2016-07-16
263,kendall   kylie be so cuuutttee!,2016-07-16
264,kendall   kylie be such an beautiful ass,2016-07-16
265, tcehy  gluuv 2 0 0  4 55  iphone world grossing rankings as of jul 15,2016-07-16
266,my 123 5 million follower on the kendall and kylie,2016-07-16
267,check out kendall and kylie!justin bieber,2016-07-16
268,check out kendall and kylie!hey!!,2016-07-17
269,be that kendall and kylie ?,2016-07-17
270, tcehy  gluuv 2 0 11  4 05  iphone world grossing rankings as of jul 16,2016-07-17
271,totally judging you for the  kendall and kylie,2016-07-17
272,kendall   kylie on my phone literally make my day hyper,2016-07-17
273,check out kendall and kylie!all i do be play this game ok,2016-07-17
274,its3 30 and i can t sleep because i start an event on the kendall and kylie i need to leave the house at 11 30 tomorrow so,2016-07-18
275,check out kendall and kylie!,2016-07-18
276,a guy from the kendall kylie ask me out on a date,2016-07-18
277,check out kendall and kylie the whores!,2016-07-18
278,tell the programmer the content for an wow such talent,2016-07-18
279,hold the fuck up we can chat on that kylie and kendall ???????? lemme download it again,2016-07-18
280, tcehy  gluuv 2 0 11  4 55  iphone world grossing rankings as of jul 17,2016-07-18
281,check out kendall and kylie!,2016-07-18
282,i m in the 10k club in kendall and kylie  come join me! i make that bitch famoussss goddamn!,2016-07-18
283,check out kendall and kylie!so,2016-07-18
284,check out kendall and kylie!,2016-07-18
285,i m in the 100 club in kendall and kylie  come join me! cheguei galera,2016-07-18
286,check out kendall and kylie!love it install it it and tell what your name be on i,2016-07-19
287,do i want to get real,2016-07-19
288,check out kendall and kylie!love it,2016-07-19
289, tcehy  gluuv 2 0 11  4 55  iphone world grossing rankings as of jul 18,2016-07-19
290,kendall and kylie pa more,2016-07-19
291,jk im play that kendall kylie first wait,2016-07-19
292,check out kendall and kylie!,2016-07-19
293,i don t even like kendall and kylie but i have be play their all day,2016-07-20
294,ok now you should have an ashley benson like kylie and kendall s one,2016-07-20
295,check out my new nigga on the kendall and kylie!,2016-07-20
296,check out kendall and kylie!lo,2016-07-20
297,check out kendall and kylie!yeh,2016-07-20
298,check out kendall and kylie!yeh hell yeh,2016-07-20
299,kendall and kylie jenner in nyc after they reveal their game,2016-07-20
300, tcehy  gluuv 2 0 11  4 55  iphone world grossing rankings as of jul 19,2016-07-20
301,kendall and kylie on the store,2016-07-20
302,hooked on cutout embroider goddess neck tank top that i find on the pacsun,2016-07-20
303,latest guilty pleasure  thecc,2016-07-20
304,i actually download your kendall   kylie it s be just awesome,2016-07-20
305,check out kendall and kylie!h,2016-07-20
306,check out kendall and kylie!hell yeh,2016-07-20
307,check out kendall and kylie!this game guy,2016-07-20
308,check out kendall and kylie!love this,2016-07-20
309,check out kendall and kylie!love this game,2016-07-21
310,so i redownload the kendall and kylie because i have the hack so i be rich and beautiful and i really feel like feel successful,2016-07-21
311,i agree  the kendall and kylie bad guy look like t shady  like the kim k bad guy be obviously p shitlon,2016-07-21
312,check out kendall and kylie!,2016-07-21
313,i unapologetically play the kendall n kylie game on my phone,2016-07-21
314, tcehy  gluuv 2 0 11  4 55  iphone world grossing rankings as of jul 20,2016-07-21
315,be into the kendall kylie lately,2016-07-21
316,check out kendall and kylie!coool,2016-07-21
317,its basically just like the kim k and kendall   kylie lmao,2016-07-21
318,i m in the 100 club in kendall and kylie  come join me! i have no life,2016-07-22
319, tcehy  gluuv 2 0 11  4 55  iphone world grossing rankings as of jul 21,2016-07-22
320,honestly id go to sleep but i have complete my mission on the kylie kendall,2016-07-22
321,be the overall you re wear in the picture of your kylie and kendall bag on your apart of your guy clothing line ??,2016-07-22
322,be you on the kendall and kylie,2016-07-22
323,hooked on crochet side skimpy bikini bottom that i find on the pacsun,2016-07-23
324, tcehy  gluuv 2 0 11  4 55  iphone world grossing rankings as of jul 22,2016-07-23
325,who would ve thought it would be  same with kylie   kendall to launch a  3month ?,2016-07-23
326,check out kendall and kylie!one love,2016-07-23
327,kendall and kylie jenner just follow me,2016-07-24
328,hahahahaha oh no not againi m in the 1k club in kendall and kylie  come join me!,2016-07-24
329,after month i decide to delete the kendall and kylie  ,2016-07-24
330,nothing worse than when u forget u have an event run on the kendall and kylie and end up with 2 star,2016-07-24
331,check out kendall and kylie!laugh out loud,2016-07-24
332,mao ning kendall kylie ?,2016-07-24
333, tcehy  gluuv 2 0 11  4 55  iphone world grossing rankings as of jul 23,2016-07-24
334,tomorrow at 10am pst the secret will be reveal on   the kylie jenner official,2016-07-25
335,i m obsessing over new  kylie !! it s strongly addictive!,2016-07-25
336, tcehy  gluuv 2 0 11  4 55  iphone world grossing rankings as of jul 24,2016-07-25
337,kim buy my !khloe watch my show!kouney buy our clothes!kylie buy my lip kit!kendall i make ice cream,2016-07-25
338,kim buy my !khloe watch my show!kouney buy our clothes!kylie buy my lip kit!kendall i make ice cream,2016-07-25
339,the kendall and kylie be throw shade at donald trump i m scream,2016-07-26
340,the kendall and kylie be throw shade at donald trump i m scream,2016-07-26
341,shoulda be studying  instead,2016-07-26
342, tcehy  gluuv 2 0 11  4 55  iphone world grossing rankings as of jul 25,2016-07-26
343,i download kendall   kylie s last night and i ve already spend about  50  i,2016-07-26
344,ok this be super dumb but i m play kendall and kylie s and im go on a date with this absolute hottie,2016-07-26
345,i have 1 million follower on the kendall and kylie lmao,2016-07-26
346,cant believe im addict to kendall and kylie s,2016-07-26
347,my cousin just run it to you on the kendall and kylie in an ad ,2016-07-27
348,wazaaaaaaaa hahahahai m in the 10k club in kendall and kylie  come join me!,2016-07-27
349, tcehy  gluuv 2 0 11  4 55  iphone world grossing rankings as of jul 26,2016-07-27
350,hooked on button down plaid flannel shirt that i find on the pacsun,2016-07-27
351,hooked on mock neck keyhole tank top that i find on the pacsun,2016-07-27
352,hooked on turtleneck tank dress that i find on the pacsun,2016-07-28
353,hooked on v neck slip dress that i find on the pacsun,2016-07-28
354,hooked on cutout front mock neck dress that i find on the pacsun,2016-07-28
355,glu game inckendall and kylie,2016-07-28
356, tcehy  gluuv 2 0 11  4 55  iphone world grossing rankings as of jul 27,2016-07-28
357,hooked on deep v neck ribbed bodycon dress that i find on the pacsun,2016-07-28
358,hooked on racerback ribbed midi dress that i find on the pacsun,2016-07-28
359,more pic of youtube red show on the kendall and kylie !!,2016-07-29
360,more pic of youtube red show on the kendall and kylie !!,2016-07-29
