,tweet,Date
361,hi i play your kendall and kylie your be awesome follow me on it the username be kendal and follow on twitter love you,2016-07-29
362,hooked on crochet embroider tank top that i find on the pacsun,2016-07-29
363,i be restart kylie and kendall s game!,2016-07-29
364,ngl i m sit here play the kendall and kylie,2016-07-29
365, tcehy  gluuv 2 0 11  4 55  iphone world grossing rankings as of jul 28,2016-07-29
366,newold picture of kendall,2016-07-29
367,newold picture of kendall,2016-07-29
368,newold picture of kendall,2016-07-29
369,newold picture of kendall,2016-07-29
370,hooked on button down long sleeve romper that i find on the pacsun,2016-07-29
371,phone  cannot update  insufficient storage space me what do you mean theres no space i deleted kendall and kylie s game,2016-07-29
372,can i just say i really love the kendall and kylie because i ve never look so good,2016-07-29
373,hooked on kendall   kylie mock neck keyhole tank top that i find on the pacsun  ,2016-07-29
374,cannot stop playin kendall and kylie s game on the store!!,2016-07-29
375,latest guilty pleasure  thecc,2016-07-30
376,hooked on kendall   kylie eyelet button front tank top that i find on the pacsun   love this outfit,2016-07-30
377,hooked on kendall   kylie lace shoulder tie romper that i find on the pacsun  ,2016-07-30
378,check out kendall and kylie!b,2016-07-30
379, tcehy  gluuv 2 0 11  4 55  iphone world grossing rankings as of jul 29,2016-07-30
380,i hate the kendall and kylie for make energy so expensive when it come to diamond or whatever theyre call shake my head,2016-07-30
381,actually i dislike the kendall and kylie for a lot of reason but i still keep play it,2016-07-30
382,hooked on kendall   kylie surplice long sleeve romper that i find on the pacsun  ,2016-07-30
383,i m in the 100k club in kendall and kylie  come join me!,2016-07-31
384,i m addicted to the kendall   kylie and it doesn t help that my  krew  on there is lit,2016-07-31
385,kendall   kylie game be here!,2016-07-31
386,should i download kendall   kylie ? any suggestion ? how be this?,2016-07-31
387, tcehy  gluuv 2 0 11  4 55  iphone world grossing rankings as of jul 30,2016-07-31
388,this be me and kylie jenner on kendall and kyile,2016-07-31
389,check out kendall and kylie!huh,2016-07-31
390,the kendall and kylie have take over my life like for the past week that all i have be doing  but i havent spend any    so far so,2016-07-31
391, tcehy  gluuv 2 0 11  4 55  iphone world grossing rankings as of jul 31,2016-08-01
392,don t worry guy,2016-08-01
393,my fave sister edition,2016-08-01
394,my fave sister edition,2016-08-01
395,i need a lit and active krew in the kendall and kylie,2016-08-01
396,i need a lit and active krew in the kendall and kylie,2016-08-01
397,my friend cant come in kendall and kylie even if she save everything r i p,2016-08-01
398,save my bestie s  kendall and kylie game,2016-08-01
399,i m in the 10k club in kendall and kylie  come join me!,2016-08-02
400,hooked on ribbed long sleeve swing dress that i find on the pacsun,2016-08-02
401,i m in the 1 million club in kendall and kylie  come join me!,2016-08-02
402, tcehy  gluuv 2 0 11  4 55  iphone world grossing rankings as of aug 1,2016-08-02
403,accidentally download the kendall and kylie again laugh out loud,2016-08-02
404,this look better than kim and kendall and kylie s,2016-08-03
405, tcehy  gluuv 2 0 11  4 55  iphone world grossing rankings as of aug 2,2016-08-03
406,im so do w the kendall and kylie  ,2016-08-03
407,i download your it s really cool  i also have the kendall and kylie game,2016-08-03
408, tcehy  gluuv  2 1 0 update release,2016-08-03
409,when they cut kendall out of the kendall and kylie icon,2016-08-03
410,this look better than kim and kendall and kylie s,2016-08-03
411,check out kendall and kylie!me and my love,2016-08-03
412,yes i am playing the kendall   kylie  i actually like it  ,2016-08-03
413,check out kendall and kylie!,2016-08-04
414,check out kendall and kylie!,2016-08-04
415,why tf be kylie only on the   its call kendall and kylie for a reason god damn,2016-08-04
416,so do kendall drop out of the kendall and kylie ?,2016-08-04
417,so when i delete the kendall and kylie on my other phone i accidentally take it off game center too and now all my hard work,2016-08-04
418,how do i use the gc thing on the kendall and kylie,2016-08-04
419, tcehy  gluuv 2 0 11 4 55 iphone world grose rnkng as of aug 3,2016-08-04
420,they kendall and kylie logo be literally just a pic of kylie,2016-08-04
421,i start to play the kendall kylie again and i be addict   again,2016-08-04
422,hooked on lace hem romper that i find on the pacsun,2016-08-04
423,why do the kendall and kylie only have kylie s face on it oh and pls dont ask why i name it ass,2016-08-04
424,hooked on mock neck short sleeve t shirt that i find on the pacsun,2016-08-04
425,i find a sister in kendall and kylie ! yay! cheer to 1d mwap,2016-08-04
426,why be it just kylie s face on the kendall and kylie game now? like why isn t it two person anymore,2016-08-04
427,why would they update the kendall   kylie game   only have kylie s face on the icon,2016-08-04
428,kendall   kylie isn t working,2016-08-04
429,what the fuck i update my phone and the kendall   kylie reset  ,2016-08-04
430,hooked on oversized crew neck t shirt that i find on the pacsun,2016-08-04
431,hooked on chiffon slip dress that i find on the pacsun,2016-08-05
432,why be kendall crop out of the kendall and kylie logo jdkehhsisbhejdk,2016-08-05
433,the kendall and kylie only have kylie on the front,2016-08-05
434,why be kylie the only face on the kendall and kylie game,2016-08-05
435,my kendall and kylie win t work lmao,2016-08-05
436, tcehy  gluuv 2 1 0  4 55 iphone world grosing rnkngs as of aug 4,2016-08-05
437,i redownlade the kylie and kendall someone help me hack it,2016-08-05
438,kendall   kylie available atrepository ,2016-08-05
439,i m so do with that kylie and kendall   they have way too many glitch,2016-08-05
440,kylie s face on the kendall and kylie   ,2016-08-06
441,i ve been playing the kendall and kylie  for like 3 hours straight,2016-08-06
442,why do i spend  50  on the kendall and kylie,2016-08-06
443,kendall and kylie,2016-08-06
444, tcehy  gluuv 2 1 0  4 55 iphone world grosing rnkngs as of aug 5,2016-08-06
445,hooked on kendall   kylie button down plaid flannel shirt that i find on the pacsun  ,2016-08-07
446,beach day fun kendall and kylie!,2016-08-07
447,kendall and kylie,2016-08-07
448,hooked on two tone satin bomber jacket that i find on the pacsun,2016-08-07
449,just downloaded kendall and kylie  i m having so much fun,2016-08-07
450,hooked on kendall   kylie weave wrap skirt that i find on the pacsun  ,2016-08-07
451, tcehy  gluuv 2 1 0  4 05 iphone world grossing rnkngs as of aug 6,2016-08-07
452,leave my chef boyfriend on the kendall and kylie game for an oil tycoon ,2016-08-07
453,i m literally living my life through the kendall and kylie,2016-08-07
454,check out kendall and kylie!new girlfrind,2016-08-07
455, tcehy  gluuv 2 1 0  4 05 iphone world grosing rnkngs as of aug 7,2016-08-08
456,kendall and kylie let me sleep pls,2016-08-08
457,ughhhh she should totally do a comp on her to win sign cover like kendall and kylie do,2016-08-08
458,check out kendall and kylie!i look gooooood!!!!!,2016-08-08
459,my day consist of watch netflix and play the kendall and kylie,2016-08-08
460,i delete desiree kendall and kylie for try to take my phone and tweet creepy thing,2016-08-08
461,hooked on weave wrap skirt that i find on the pacsun,2016-08-09
462,guy go download the kendall and kylie now it s lit,2016-08-09
463,hooked on tie front tiered dress that i find on the pacsun,2016-08-09
464, tcehy  gluuv 2 1 0  4 05 iphone world grosing rnkngs as of aug 8,2016-08-09
465,check out kendall and kylie! i got your  it s fun!,2016-08-09
466,exhibit a i can t stop play the kylie and kendall   i cant stop ,2016-08-09
467,i m in the 100k club in kendall and kylie  love this game it s so addicting i love it,2016-08-09
